{
  "$schema": "https://json-schema.org/draft/2020-12/schema",
  "title": "agents library item",
  "type": "object",
  "required": [
    "icon",
    "id",
    "integrations",
    "locales",
    "order",
    "prefill"
  ],
  "properties": {
    "icon": {
      "type": "string"
    },
    "id": {
      "type": "string"
    },
    "integrations": {
      "type": "array"
    },
    "locales": {
      "type": "object"
    },
    "order": {
      "type": "integer"
    },
    "prefill": {
      "type": "object"
    }
  },
  "additionalProperties": true
}
